{
  "taxonomy_type": "role",
  "version": "1.0.0",
  "updated_at": "2026-07-01",
  "entries": [
    {
      "id": "role.a",
      "canonical": "Role A",
      "aliases": ["RA", "Role-A"],
      "expansions": [ { "target_id": "role.b", "weight": 0.5, "notes": "test expansion" } ],
      "status": "active",
      "created_at": "2026-07-01",
      "updated_at": "2026-07-01"
    },
    {
      "id": "role.b",
      "canonical": "Role B",
      "aliases": [],
      "expansions": [],
      "status": "active",
      "created_at": "2026-07-01",
      "updated_at": "2026-07-01"
    }
  ]
}
